title,source,category,published_date,author,content,sentiment,word_count,views,shares
"Tech Giants Report Record Earnings in Q4",TechNews,technology,2024-01-15,John Smith,"Major technology companies reported unprecedented earnings in the fourth quarter, driven by strong cloud computing demand...",0.75,850,45000,1200
"Breaking: Climate Summit Reaches Historic Agreement",GlobalNews,climate,2024-01-16,Sarah Johnson,"World leaders have reached a landmark agreement to reduce carbon emissions by 50% by 2030...",0.82,1200,120000,8500
"Sports: Championship Finals Set to Begin",SportsDaily,sports,2024-01-17,Mike Brown,"The championship finals are set to begin this weekend with two top teams competing...",0.65,600,35000,890
"Political Debate Intensifies Over Healthcare Reform",PoliticsToday,politics,2024-01-18,Jane Doe,"The ongoing debate over healthcare reform has intensified as lawmakers propose new legislation...",-0.25,950,78000,3200
"Market Watch: Stocks Rally Amid Economic Optimism",FinancialTimes,finance,2024-01-19,Robert Lee,"Stock markets rallied today as investors showed renewed optimism about economic recovery...",0.70,700,52000,1450
"Health Study Reveals Benefits of Mediterranean Diet",HealthWeekly,health,2024-01-20,Dr. Emily Chen,"A new comprehensive study reveals significant health benefits associated with the Mediterranean diet...",0.85,1100,95000,5600
"Entertainment: Award Season Kicks Off with Surprises",EntertainmentMag,entertainment,2024-01-21,Lisa Wang,"The award season has officially kicked off with several surprise nominations...",0.55,500,28000,720
"Science Breakthrough: New Discovery Could Change Energy Storage",ScienceDaily,science,2024-01-22,Dr. Alan Park,"Scientists have announced a breakthrough in energy storage technology that could revolutionize...",0.90,1300,150000,12000
"Local News: City Council Approves New Infrastructure Plan",CityNews,local,2024-01-23,Mark Thompson,"The city council has approved a comprehensive infrastructure improvement plan...",0.45,450,15000,320
"Opinion: The Future of Remote Work in 2024",BusinessInsider,business,2024-01-24,Christine Miller,"As we enter 2024, the debate over remote work continues to evolve...",0.30,800,42000,1100
"Education: Universities Expand Online Learning Programs",EducationToday,education,2024-01-25,Prof. David Kim,"Universities across the country are expanding their online learning offerings...",0.60,650,25000,680
"Travel: Top Destinations for Spring 2024",TravelWeekly,travel,2024-01-26,Amanda Ross,"Travel experts reveal the most popular destinations for spring 2024...",0.72,550,38000,2100
"Technology: AI Adoption Accelerates Across Industries",TechInsider,technology,2024-01-27,Kevin Zhang,"Artificial intelligence adoption is accelerating across various industries...",0.68,900,62000,2800
"World News: Peace Talks Resume in Conflict Zone",WorldReport,world,2024-01-28,Anna Schmidt,"Peace talks have resumed between conflicting parties with renewed hope...",0.45,1000,88000,4500
"Environment: Ocean Cleanup Project Shows Progress",GreenEarth,environment,2024-01-29,Dr. Maria Garcia,"The ocean cleanup project has shown significant progress in removing plastic...",0.88,750,72000,3800
"Business: Startup Funding Reaches New Heights",VentureBeat,business,2024-02-01,Tom Wilson,"Startup funding has reached unprecedented levels in the first month of 2024...",0.75,600,48000,1650
"Culture: Art Exhibition Opens to Critical Acclaim",ArtReview,culture,2024-02-02,Rachel Green,"A new art exhibition has opened to critical acclaim at the downtown museum...",0.70,400,18000,520
"Crime: City Reports Decrease in Violent Crime",MetroNews,crime,2024-02-03,Officer James,Local law enforcement agencies report a significant decrease in violent crime...,0.35,350,22000,450
"Food: Restaurant Week Returns with New Participating Venues",FoodMag,food,2024-02-04,Chef Amanda,"Restaurant week is back with over 100 participating venues offering special menus...",0.80,500,35000,1450
"Autos: Electric Vehicle Sales Surge in January",AutoNews,autos,2024-02-05,Chris Taylor,"Electric vehicle sales have surged in January, marking a 45% increase...",0.78,650,55000,2300
